#CODE;ENGLISH;FRENCH;GERMAN;;SPANISH;;;;;;;;;x;,,,,,,,,,,
### RELIGIOUS EVENTS ###
# FIRST RAVEN EVENTS #
EVTTITLE_ROBMODNORSE_00041;The Godslaws;Les lois des Dieux;Die Gesetze der Götter;;Las leyes de los dioses;;;;;;;;;x,,,,,,,,,,
EVTDESC_ROBMODNORSE_00041_BEYD;[Root.GetTitledName], the new great leader of the Norse faith, in consultation with the Goðis and in communion with the Allfather himself, has decreed the Guðalog (Godslaws), and published our new Holy Book. Written in ancient runes, this most glorious tome has chapters on Creation, the Gods, Ragnarok, and the eponymous Godslaws govering Miðgarðr, the realm of men.\n\nA standardised liturgy and a formal church hierarchy has also been established, led by [Root.GetHerHis] Mightiness [Root.GetTitledName], who commands all good Norsemen and women to follow the new laws and to obey the Goðis in all spiritual matters.;[Root.GetTitledName], le nouveau grand chef de la foi nordique, en consultation avec les Goðis et en communion avec l'Allfather lui-même, a décrété le Guðalog (lois des dieux) et publié notre nouveau livre sacré. Écrit dans les runes anciennes, ce tome le plus glorieux a des chapitres sur la Création, les dieux, Ragnarok et les lois des dieux éponymes qui gouvernent Miðgarðr, le royaume des hommes. Une liturgie normalisée et une hiérarchie formelle de l'église ont également été établies, menées par [Root.GetTitledName], qui commande tous les bons hommes et femmes nordiques de suivre les nouvelles lois et d'obéir aux Goðis dans toutes les questions spirituelles.;[Root.GetTitledName], der neue große Führer des nordischen Glaubens, in Absprache mit den Goðis und in Gemeinschaft mit dem Allfather selbst, hat die Guðalog (Göttergesetze) verordnet und unser neues Heiliges Buch veröffentlicht. In den alten Runen geschrieben, hat dieses herrlichste Tome Kapitel über die Schöpfung, die Götter, Ragnarok und die gleichnamigen Göttergesetze, die Miðgarðr, das Reich der Menschen, Eine standardisierte Liturgie und eine formale kirchliche Hierarchie wurde auch von [Root.GetTitledName] geführt, der alle guten nordischen Männer und Frauen befiehlt, den neuen Gesetzen zu folgen und die Goðis in allen spirituellen Dingen zu befolgen.;;[Root.GetTitledName], el nuevo gran líder de la fe nórdica, en consulta con el Goðis y en comunión con el Allfather mismo, ha decretado el Guðalog (leyes de dioses), y ha publicado nuestro nuevo libro santo. Escrito en runas antiguas, este tomo más glorioso tiene capítulos sobre la Creación, los dioses, Ragnarok y las leyes homónimas de los dioses que gobiernan Miðgarðr, el reino de los hombres. También se ha establecido una liturgia estandarizada y una jerarquía formal de la iglesia, dirigida por [Root.GetTitledName], que manda a todos los buenos hombres y mujeres nórdicos seguir las nuevas leyes y obedecer a los Goðis en todos los asuntos espirituales.;;;;;;;;;x
EVTDESC_ROBMODNORSE_00041_OLD;The tyranny of the so-called Oðinshrafn knows no bounds. [Root.GetSheHeCap] has published a new Holy Book, the Guðalog (Godslaws), supposedly in communion with the Allfather (as if the High One would deign to speak to [Root.GetHerHim]). It offers an interpretation of Creation, the Gods, and Ragnarok, and the eponymous Godslaws, all of which serve simply to legitimise [Root.GetFirstName]’s false position of power. Every true Norseman knows that we need no laws from the Gods to govern us, and we certainly don’t need a spiritual leader!;La tyrannie du soi-disant Oðinshrafn ne connaît pas de limites. [Root.GetSheHeCap] a publié un nouveau livre sacré, le Guðalog (lois des dieux), supposément en communion avec l'Alfaðir (comme si le Haut Désignait de parler à [Root.GetHerHim]). Il offre une interprétation de la Création, des dieux et de Ragnarok, et des lois des dieux éponymes, qui servent simplement à légitimer la fausse position du pouvoir [Root.GetFirstName]. Tout vrai homme nordique sait que nous n'avons pas besoin de lois des Dieux pour nous gouverner, et nous n'avons certainement pas besoin d'un chef spirituel!;Die Tyrannei des sogenannten Oðinshrafn kennt keine Grenzen. [Root.GetSheHeCap] hat ein neues Heiliges Buch, das Guðalog (Göttergesetze) veröffentlicht, angeblich in Gemeinschaft mit dem Alfaðir (als ob der Hohe würde es wagen, mit [Root.GetHerHim] zu sprechen). Es bietet eine Interpretation der Schöpfung, der Götter und Ragnaroks und der gleichnamigen Gesetze der Götter, die alle dazu dienen, die falsche Machtposition von [Root.GetFirstName] zu legitimieren. Jeder echte nordische Mann weiß, dass wir keine Gesetze von den Göttern brauchen, um uns zu regieren, und wir brauchen sicher keinen spirituellen Führer!;;La tiranía de los llamados Oðinshrafn no conoce límites. [Root.GetSheHeCap] ha publicado un nuevo Libro Sagrado, el Guðalog (las leyes de los dioses), supuestamente en comunión con el Alfaðir (como si el Alto se dignara hablar a [Root.GetHerHim]). Ofrece una interpretación de la Creación, los Dioses y Ragnarok, y las leyes de los dioses del mismo nombre, las cuales sirven simplemente para legitimar la falsa posición de poder de [Root.GetFirstName]. Todo verdadero hombre nórdico sabe que no necesitamos leyes de los dioses para gobernarnos, y ciertamente no necesitamos un líder espiritual.;;;;;;;;;x
EVTDESC_ROBMODNORSE_00041_INFIDEL;The new leader of the Norse infidels [Root.GetTitledName] has published a Holy Book, the so-called Guðalog (Godslaws), as well as a standardised liturgy and a formal church hierarchy. It seems the reformation in those cold lands continues apace, and the new religious fervour is solidifying into an organised and powerful faith. Dark news indeed, but the [This.Religion.GetPriestTitle]s assure all good [This.Religion.GetName] men that [This.Religion.GetHighGodName]’s power will overcome the heathen zealots.;Le nouveau chef des infidèles nordiques [Root.GetTitledName] a publié un livre sacré, le soi-disant Guðalog (lois des dieux), ainsi qu'une liturgie normalisée et une hiérarchie formelle de l'église. Il semble que la réforme dans ces pays froids se poursuive, et la nouvelle ferveur religieuse se solidifie dans une foi organisée et puissante. Les nouvelles sombres, en effet, mais [This.Religion.GetPriestTitle] s garantissent à tous les hommes [This.Religion.GetName] les hommes qui [Root.Religion.GetHighGodName] vont surmonter les fanatiques païens.;Der neue Führer der nordischen Ungläubigen [Root.GetTitledName] hat ein heiliges Buch, die sogenannten Guðalog (Göttergesetze), sowie eine standardisierte Liturgie und eine formale kirchliche Hierarchie veröffentlicht. Es scheint, dass die Reformation in diesen kalten Ländern fortschreitet, und die neue religiöse Leidenschaft verfestigt sich zu einem organisierten und mächtigen Glauben. Dunkle Nachrichten in der Tat, aber die [Root.Religion.GetPriestTitle] s versichern alle guten [This.Religion.GetName] Männer, die [Root.Religion.GetHighGodName] 's Macht wird die heidnischen Eiferer überwinden.;;El nuevo líder de los infieles nórdicos [Root.GetTitledName] ha publicado un Libro Sagrado, el llamado Guðalog (las leyes de los dioses), así como una liturgia estandarizada y una jerarquía de la iglesia formal. Parece que la reforma en esas frías tierras continúa con rapidez, y el nuevo fervor religioso se está consolidando en una fe organizada y poderosa. Las noticias oscuras ciertamente, pero los [This.Religion.GetPriestTitle] s aseguran a todos los buenos [This.Religion.GetName] que el poder de [This.Religion.GetHighGodName] superará a los fanáticos paganos.;;;;;;;;;x
EVTOPTA_ROBMODNORSE_00041_BEYD;Glory to the Oðinshrafn!;Gloire à l'Oðinshrafn!;Ruhm an die Oðinshrafn!;;¡Gloria al Oðinshrafn!;;;;;;;;;x,,,,,,,,,,
EVTOPTA_ROBMODNORSE_00041_OLD;[This.Religion.GetRandomEvilGodNameCap] curse this ‘Oðinshrafn’!;[This.Religion.GetRandomEvilGodNameCap] maudit ce 'Oðinshrafn'!;[This.Religion.GetRandomEvilGodNameCap] Fluch dieses 'Oðinshrafn'!;;[This.Religion.GetRandomEvilGodNameCap] maldición este 'Oðinshrafn'!;;;;;;;;;x,,,,,,,,,,
EVTOPTA_ROBMODNORSE_00041_INFIDEL;[This.Religion.GetRandomGodNameCap] protect us from the Vikings!;[This.Religion.GetRandomGodNameCap] nous protège des Vikings!;[This.Religion.GetRandomGodNameCap] beschütze uns vor den Wikinger!;;[This.Religion.GetRandomGodNameCap] nos protegen de los vikingos!;;;;;;;;;x,,,,,,,,,,
EVTDESC_ROBMODNORSE_00042;In a grand ceremony in [Root.Capital.GetName], your official coronation as Oðinshrafn is about to begin. The assemblage cheers as your [Root.GetLordSpiritualName] [Root.job_spiritual.GetFirstName] places a newly forged and impressive Raven’s Crown upon your head. You are announced as the Hrafnfyrstr (First Raven), and a hundred sows are sacrificed to bless your new title, with the meat shared with all present. This epithet will be remembered forevermore, and all your progeny shall live in the glory of your great and pious deeds.;Dans une grande cérémonie dans [Root.Capital.GetName], votre couronnement officiel comme Oðinshrafn est sur le point de commencer. L'assemblage répond comme votre [Root.GetLordSpiritualName] [Root.job_spiritual.GetFirstName] place une nouvelle Forged and impressive Raven's Crown sur votre tête. Vous êtes annoncé comme le Hrafnfyrstr (First Raven), et une centaine de truies sont sacrifiées pour bénir votre nouveau titre, avec la viande partagée avec tous les présents. Cette épithète sera rappelée pour toujours, et toute votre progéniture vivra dans la gloire de vos grands et pieux actes.;In einer großen Zeremonie in [Root.Capital.GetName], ist Ihre offizielle Krönung als Oðinshrafn zu beginnen. Die Assemblage Jubel als Ihr [Root.GetLordSpiritualName] [Root.job_spiritual.GetFirstName] stellt eine neu geschmiedete und beeindruckende Rabenkrone auf den Kopf. Sie werden als Hrafnfyrstr (erster Rabe) angekündigt, und hundert Sauen werden geopfert, um Ihren neuen Titel zu segnen, mit dem Fleisch, das mit allen Anwesenden geteilt wird. Dieser Beiname wird für immer in Erinnerung bleiben, und alle deine Nachkommen sollen in der Herrlichkeit deiner großen und frommen Taten leben.;;En una gran ceremonia en [Root.Capital.GetName], su coronación oficial como Oðinshrafn está a punto de comenzar. El ensamblaje anima cuando su [Root.GetLordSpiritualName] [Root.job_spiritual.GetFirstName] coloca una Corona de Raven recientemente forjada e impresionante sobre su cabeza. Se anuncia como el Hrafnfyrstr (Primer Cuervo), y se sacrifican cien cerdas para bendecir tu nuevo título, con la carne compartida con todos los presentes. Este epíteto será recordado para siempre, y toda tu progenie vivirá en la gloria de tus grandes y piadosos hechos.;;;;;;;;;x
EVTOPTA_ROBMODNORSE_00042;The Alfaðir smiles on me today.;L'Alfaðir me sourit aujourd'hui.;Der Alfaðir lächelt mich heute an.;;El Alfaðir me sonríe hoy.;;;;;;;;;x,,,,,,,,,,
EVTOPTB_ROBMODNORSE_00042;I should keep the memory of my past alive, too.;Je devrais garder le souvenir de mon passé en vie aussi.;Ich sollte die Erinnerung an meine Vergangenheit auch am Leben halten.;;Debería mantener vivo el recuerdo de mi pasado.;;;;;;;;;x,,,,,,,,,,
EVTTOOLTIPB_ROBMODNORSE_00042;You can keep your current nickname instead of taking the new one, if you wish;Vous pouvez garder votre pseudo actuel au lieu de prendre le nouveau, si vous le souhaitez;Du kannst deinen aktuellen Spitznamen behalten, anstatt den neuen zu nehmen, wenn du es wünschst;;Puedes guardar tu apodo actual en lugar de tomar el nuevo, si lo deseas;;;;;;;;;x,,,,,,,,,,
EVTDESC_ROBMODNORSE_00043;In a grand ceremony in [From.Capital.GetName], [From.GetFirstName]’s official coronation as Oðinshrafn is about to begin. The assemblage cheers as a newly forged and impressive Raven’s Crown is placed upon [From.GetHerHis] head, and [From.GetSheHe] is announced as [From.GetFirstNameWithNick] (First Raven). This epithet will be remembered forevermore, and all [From.GetHerHis] progeny shall live in the glory of [From.GetHerHis] great and pious deeds.;Dans une grande cérémonie dans [From.Capital.GetName], le couronnement officiel [From.GetFirstName] comme Oðinshrafn est sur le point de commencer. L'assemblage s'habille comme une couronne Raven récemment forgée et impressionnante est placée sur [From.GetHerHis] head, et [From.GetSheHe] est annoncé comme [From.GetFirstNameWithNick] (premier corbeau). Cette épithète sera rappelée à jamais pour l'instant, et toute la descendance [From.GetHerHis] vivra dans la gloire de [From.GetHerHis] les grands et pieux actes.;In einer großen Zeremonie in [From.Capital.GetName], [From.GetFirstName] 's offizielle Krönung als Oðinshrafn ist zu beginnen. Der Assemblage-Jubel als neu geschmiedete und eindrucksvolle Rabenkrone wird auf [From.GetHerHis] Kopf gelegt und [From.GetSheHe] wird als [From.GetFirstNameWithNick] (erster Rabe) angekündigt. Dieser Beiname wird für immer in Erinnerung bleiben, und alle Nachherin Nachkommen sollen in der Herrlichkeit von [From.GetHerHis] großen und frommen Taten leben.;;En una gran ceremonia en [From.Capital.GetName], [From.GetFirstName] la coronación oficial como Oðinshrafn está a punto de comenzar. La congregación alegra como una Corona de Raven recién forjada e impresionante se coloca sobre [From.GetHerHis] cabeza, y [From.GetSheHe] se anuncia como [From.GetFirstNameWithNick] (primer cuervo). Este epíteto será recordado para siempre, y toda descendencia de [From.GetHerHis] vivirá en la gloria de [From.GetHerHis] grandes y piadosos hechos.;;;;;;;;;x
EVTOPTA_ROBMODNORSE_00043;The Alfaðir smiles on [From.GetHerHis] Mightiness today.;L'Alfaðir sourit sur [From.GetTitledFirstName] aujourd'hui.;Der Alfaðir lächelt heute auf [From.GetTitledFirstName].;;El Alfaðir sonríe en [From.GetTitledFirstName] hoy.;;;;;;;;;x,,,,,,,,,,
# ESTABLISH THE NORSE MONASTIC ORDERS #
EVTTITLE_ROBMODNORSE_00044;Protectors of the Faithful;Protecteurs des fidèles;Beschützer der Gläubigen;;Protectores de los fieles;;;;;;;;;x,,,,,,,,,,
EVTDESC_ROBMODNORSE_00044;Reports mount of pious Beyðir coming under attack as they worship by those who refute the Guðalog and deny [Root.GetTitledFirstName]’s divine provenance. But a secretive order has emerged to protect the faithful, guarding shrines and rooting out the dissidents.\n\nThey call themselves the Eiðmenn (Oathsmen), and all have taken a solemn vow to put aside earthly concerns and defend the new faith. And now, the founder of the Order – known as [robmodnorse_oathwriter.GetFirstName] the Oathswriter – has arrived at your court to offer his service.;Les rapports montent de Beyðir pieux en train d'attaquer en adorant ceux qui réfutent le Guðalog et refusent la provenance divine de [Root.GetTitledFirstName]. Mais un ordre secret a émergé pour protéger les fidèles, surveiller les sanctuaires et éradiquer les dissidents. Ils s'appellent eux-mêmes Eiðmenn (hommes assermenté), et tous ont juré solennellement de mettre de côté les préoccupations terrestres et de défendre la nouvelle foi. Et maintenant, le fondateur de l'Ordre - connu sous le nom de [robmodnorse_oathwriter.GetFirstName] l'écrivain des serments - est arrivé à votre cour pour offrir son service.;Berichtet den Berg von frommen Beyðir, der unter Angriff kommt, wie sie von denen anbeten, die den Guðalog widerlegen und die göttliche Herkunft von Root.GetTitledFirstName verweigern. Aber eine geheimnisvolle Ordnung ist aufgetaucht, um die Gläubigen zu schützen, die Schreine zu bewachen und die Dissidenten zu verwurzeln. Sie nennen sich die Eiðmenn (Eidmenschen), und alle haben ein feierliches Gelübde genommen, um irdische Sorgen zu beiseite legen und den neuen Glauben zu verteidigen. Und jetzt ist der Begründer des Ordens - bekannt als [robmodnorse_oathwriter.GetFirstName] der Eidschreiber - an Ihren Hof angekommen, um seinen Dienst anzubieten.;;Los informes montan del beyðir piadoso que viene bajo ataque como adoran por los que refutan el Guðalog y niegan la proveniencia divina de [Root.GetTitledFirstName]. Pero un orden secreto ha surgido para proteger a los fieles, custodiando santuarios y erradicando a los disidentes. Se llaman a sí mismos Eiðmenn (los juramentados), y todos han tomado el voto solemne de dejar de lado las preocupaciones terrenales y defender la nueva fe. Y ahora, el fundador de la Orden - conocido como el escritor de juramentos - ha llegado a su corte para ofrecer su servicio.;;;;;;;;;x
EVTOPTA_ROBMODNORSE_00044;“Tell me more of your order, [robmodnorse_oathwriter.GetFirstName]!”;"Dites-moi plus votre ordre, [robmodnorse_oathwriter.GetFirstName]!";"Erzählen Sie mir mehr von Ihrer Bestellung, [robmodnorse_oathwriter.GetFirstName]!";;"Cuéntame más de tu orden, [robmodnorse_oathwriter.GetFirstName]!";;;;;;;;;x,,,,,,,,,,
EVTDESC_ROBMODNORSE_00046;You spend many hours with [From.GetFirstNameWithNick], the founder of the Oathsmen. In his younger days he was a great Viking, but was captured during a raid of a Christian settlement. He travelled far after escaping his captors, visiting remote monasteries, there learning the ways of the monks. He respected their piety, but not their pacifism: “how can a man uphold his faith if he will not fight for it?”, he sneers. On his return to the Norselands, [From.GetFirstName] recruited followers to a new brotherhood of warrior monks – the Eiðmenn.;Vous passez plusieurs heures avec [From.GetFirstNameWithNick], le fondateur des hommes assermenté. Dans ses plus jeunes jours, il était un grand Viking, mais a été capturé lors d'un raid d'un établissement chrétien. Il a voyagé loin après avoir échappé à ses ravisseurs, en visitant des monastères éloignés, en apprenant les voies des moines. Il a respecté leur piété, mais pas leur pacifisme: «comment un homme peut-il défendre sa foi s'il ne lutte pas pour cela?», Dit-il en ricanant. À son retour dans les terres nordiques, [From.GetFirstName] a recruté des disciples à une nouvelle confrérie de moines guerriers - l'Eiðmenn.;Du verbringst viele Stunden mit [From.GetFirstNameWithNick], dem Gründer der Eidmänner. In seinen jüngeren Tagen war er ein großer Wikinger, wurde aber bei einem Überfall einer christlichen Siedlung gefangen genommen. Er reiste weit, nachdem er seinen Gefangenen entkommen war, um entfernte Klöster zu besichtigen und dort die Wege der Mönche zu lernen. Er respektierte ihre Frömmigkeit, aber nicht ihren Pazifismus: "Wie kann ein Mann seinen Glauben wahren, wenn er nicht dafür kämpfen wird?", Spottet er. Bei seiner Rückkehr in die nordischen Länder rekrutierte [From.GetFirstName] Anhänger einer neuen Bruderschaft der Krieger Mönche - der Eiðmenn.;;Pasas muchas horas con [From.GetFirstNameWithNick], el fundador de los juramentados. En su juventud era un gran Vikingo, pero fue capturado durante una incursión de un asentamiento cristiano. Viajó lejos después de escapar de sus captores, visitando monasterios remotos, allí aprendiendo las maneras de los monjes. Él respetaba su piedad, pero no su pacifismo: "¿cómo puede un hombre sostener su fe si no lucha por ella?", Se burla. A su regreso a las tierras nórdicas, [From.GetFirstName] reclutó seguidores a una nueva hermandad de monjes guerreros - el Eiðmenn.;;;;;;;;;x
EVTOPTA_ROBMODNORSE_00046;“But why do you all have one eye?”;"Mais pourquoi tu as tous un œil?";"Aber warum hast du alle ein Auge?";;-Pero ¿por qué todos tienen un solo ojo?;;;;;;;;;x,,,,,,,,,,
EVTDESC_ROBMODNORSE_00048;“Ah! Only the worthy may join the Eiðmenn,” [FromFrom.GetFirstName] replies with a toothless grin, before going on the explain the trials an aspirant Eiðmaðr undertakes to prove his worth. Known as the Þorfreista (Trials of Thor), they include tests of faith, strength and martial ability, and sound arduous indeed. But the ultimate test of devotion is the final trial, the Óðinnsfreist (Trial of Odin), wherein the aspirant must remove his own eye, as the Allfather did in search of wisdom.;"Ah! Seul le digne peut rejoindre l'Eiðmenn, "[FromFrom.GetFirstName] répond avec un sourire sans dents, avant d'aller sur l'explication des épreuves, un Eiðmaðr sera en mesure de prouver sa valeur. Connu sous le nom de Þorfreista (Essais de Thor), ils incluent des tests de foi, de force et de compétences martiales, et un son pénible en effet. Mais le test ultime de la dévotion est l'essai final, l'Óðinnsfreist (Trial of Odin), dans lequel l'aspirant doit enlever son œil, comme l'a fait Alfaðir en quête de sagesse.;"Ah! Nur der Würdige kann sich dem Eiðmenn anschließen, "Mit einem zahnlosen Grinsen antwortet er, bevor er die Versuche erläutern wird, ein Eiðmaðr verpflichtet sich, seinen Wert zu beweisen. Bekannt als die Þorfreista (Versuche von Thor), schließen sie Prüfungen des Glaubens, der Stärke und der kriegerischen Fähigkeit ein und klingen mühsam. Aber der letzte Test der Hingabe ist der letzte Versuch, der Óðinnsfreist (Trial of Odin), wobei der Aspirant sein eigenes Auge entfernen muss, wie der Alfaðir auf der Suche nach Weisheit war.;;¡Ah! Sólo los dignos pueden unirse al Eiðmenn, "[FromFrom.GetFirstName] responde con una mueca desdentada, antes de ir a explicar los ensayos que un aspirante a Eiðmaðr se compromete a demostrar su valor. Conocidos como Þorfreista (Ensayos de Thor), incluyen pruebas de fe, fuerza y habilidad marcial, y son arduos de hecho. Pero la última prueba de la devoción es el juicio final, el Óðinnsfreist (Juicio de Odín), en el que el aspirante debe quitarse su propio ojo, como lo hizo el Alfaðir en busca de la sabiduría.;;;;;;;;;x
EVTOPTA_ROBMODNORSE_00048;“Fascinating! Thank you for your service, Brother [FromFrom.GetFirstName].”;"Fascinant! Merci pour votre service, Brother [From.GetFirstName].";"Faszinierend! Vielen Dank für Ihren Service, Bruder [From.GetFirstName].";;"¡Fascinante! Gracias por su servicio, Brother [From.GetFirstName].";;;;;;;;;x,,,,,,,,,,
EVTTITLE_ROBMODNORSE_00047;The First Sister of Frigg;La première soeur de Frigg;Die erste Schwester von Frigg;;La Primera Hermana de Frigg;;;;;;;;;x,,,,,,,,,,
EVTDESC_ROBMODNORSE_00047;Only men may join the Oathsmen. But at the Trúholl (Hall of Faith) where the Eiðmenn train, an order of celibate sorceresses, herbalists and soothsayers has emerged to tend the shrines, heal the wounded, and perform rituals of faith.\n\nThey are led by the beautiful [robmodnorse_firstsister.GetFirstNameWithNick] (First Sister) a powerful sorceress, who has now arrived at your court to tell you of their order. She suggests you personally sponsor the two new monastic orders, bringing them under your purview as head of the faith.;Seuls les hommes peuvent rejoindre les Oathsmen. Mais au Trúholl (salle de foi) où se formait le train d'Eiðmenn, un ordre de sorcières célibataires, d'herboristes et de devanciers a émergé pour soigner les sanctuaires, soigner les blessés et faire des rituels de foi. Ils sont dirigés par la belle [robmodnorse_firstsister.GetFirstNameWithNick] (première soeur) une puissante sorcière, qui est maintenant arrivé à votre cour pour vous informer de leur commande. Elle vous suggère de parrainer personnellement les deux nouvelles commandes monastiques, en les mettant sous votre contrôle en tant que chef de la foi.;Nur Männer können sich den Eidschützen anschließen. Aber an der Trúholl, wo der Eiðmenn-Zug, ein Befehl der Zölibat-Zauberer, Kräuterkundler und Wahrsager ist entstanden, um die Schreine zu heilen, heilen die Verwundeten und führen Rituale des Glaubens. Sie werden von der schönen [robmodnorse_firstsister.GetFirstNameWithNick] (erste Schwester) eine mächtige Zauberin geführt, die jetzt bei deinem Hof angekommen ist, um dir von ihrer Bestellung zu erzählen. Sie schlägt vor, dass Sie persönlich die beiden neuen Klosteraufträge sponsern und sie als Kopf des Glaubens in Ihre Zuständigkeit bringen.;;Sólo los hombres pueden unirse a los juramentadores. Pero en el Trúholl (salón de la fe) donde está el tren de Eiðmenn, ha surgido una orden de hechiceros célibes, herbolarios y adivinos para atender los santuarios, sanar a los heridos y realizar rituales de fe. Ellos son guiados por la hermosa [robmodnorse_firstsister.GetFirstNameWithNick] (primera hermana), una poderosa hechicera, que ha llegado a su corte para informarles de su orden. Ella sugiere que usted patrocine personalmente las dos nuevas órdenes monásticas, poniéndolas bajo su responsabilidad como cabeza de la fe.;;;;;;;;;x
EVTOPTA_ROBMODNORSE_00047;“A fine idea!”;"Une belle idée!";"Eine schöne Idee!";;"¡Una buena idea!";;;;;;;;;x,,,,,,,,,,
EVTTOOLTIPA_ROBMODNORSE_00047;You may now visit the §GIntrigue Screen§! and take the decision to establish the Norse monastic orders;Vous pouvez maintenant visiter l'écran d'intrigue et prendre la décision d'établir les ordres monastiques nordiques;Sie können jetzt den Intrigue Screen besuchen und die Entscheidung treffen, die nordischen Klosterorden zu errichten;;Ahora puede visitar la Pantalla de Intriga y tomar la decisión de establecer las órdenes monásticas nórdicas;;;;;;;;;x,,,,,,,,,,
EVTTITLE_ROBMODNORSE_00001;The Oathsmen and the Sisters;Les hommes assermenté et les Sœurs;Die Eidmänner und die Schwestern;;Los Juramentadores y las Hermanas;;;;;;;;;x,,,,,,,,,,
