#CODE;ENGLISH;FRENCH;GERMAN;;SPANISH;;;;;;;;;x;,,,,,,,,,,
EVTOPTA_ROBMODNORSE_00115;Something to make me more likeable.;;;;;;;;;;;;;x
EVTTOOLTIP_ROBMODNORSE_00115_01;[robmod_friggsister_magic.GetFirstName] will concoct something to improve your diplomacy skill (and your sex appeal...);;[From.GetFirstName] ist sehr glücklich.;;[From.GetFirstName] es muy feliz;;;;;;;;;x
EVTOPTB_ROBMODNORSE_00115;Greater strength!;Je n'ai malheureusement rien à donner pour le moment.;Tut mir leid, ich kann kein Gold erübrigen.;;Lo siento, ahora mismo no puedo prescindir del oro.;;;;;;;;;x
EVTTOOLTIP_ROBMODNORSE_00115_02;[robmod_friggsister_magic.GetFirstName] will concoct something to improve your martial and personal combat skill;[From.GetFirstName] s'en réjouit;[From.GetFirstName] ist sehr glücklich.;;[From.GetFirstName] es muy feliz;;;;;;;;;x
EVTOPTC_ROBMODNORSE_00115;A pick me up to help me work harder.;Dieu doit savoir que je soutiens cette abbaye.;Gott soll wissen, dass ich ein Freund der Kirche bin.;;Dios sabrá que apoyo la iglesia.;;;;;;;;;x
EVTTOOLTIP_ROBMODNORSE_00115_03;[robmod_friggsister_magic.GetFirstName] will concoct something to improve your stewardship skill;[From.GetFirstName] s'en réjouit;[From.GetFirstName] ist sehr glücklich.;;[From.GetFirstName] es muy feliz;;;;;;;;;x
EVTOPTD_ROBMODNORSE_00115;More options...;Je n'ai malheureusement rien à donner pour le moment.;Tut mir leid, ich kann kein Gold erübrigen.;;Lo siento, ahora mismo no puedo prescindir del oro.;;;;;;;;;x
EVTOPTE_ROBMODNORSE_00115;No thanks, Sister.;Dieu doit savoir que je soutiens cette abbaye.;Gott soll wissen, dass ich ein Freund der Kirche bin.;;Dios sabrá que apoyo la iglesia.;;;;;;;;;x
EVTOPTF_ROBMODNORSE_00115;To know if people mean to do me harm.;Je n'ai malheureusement rien à donner pour le moment.;Tut mir leid, ich kann kein Gold erübrigen.;;Lo siento, ahora mismo no puedo prescindir del oro.;;;;;;;;;x
EVTTOOLTIP_ROBMODNORSE_00115_04;[robmod_friggsister_magic.GetFirstName] will concoct something to improve your intrigue skill and your chance discover plots against you;[From.GetFirstName] s'en réjouit;[From.GetFirstName] ist sehr glücklich.;;[From.GetFirstName] es muy feliz;;;;;;;;;x
EVTOPTG_ROBMODNORSE_00115;To unlock the greater mysteries.;Je n'ai malheureusement rien à donner pour le moment.;Tut mir leid, ich kann kein Gold erübrigen.;;Lo siento, ahora mismo no puedo prescindir del oro.;;;;;;;;;x
EVTTOOLTIP_ROBMODNORSE_00115_05;[robmod_friggsister_magic.GetFirstName] will concoct something to improve your learning skill and your relations with the church;[From.GetFirstName] s'en réjouit;[From.GetFirstName] ist sehr glücklich.;;[From.GetFirstName] es muy feliz;;;;;;;;;x
EVTOPTH_ROBMODNORSE_00115;Back to the other options please.;Revenez aux autres options s'il vous plaît.;Zurück zu den anderen Optionen bitte.;;Volver a las otras opciones por favor.;;;;;;;;;x
EVTDESC_ROBMODNORSE_00117_01;The salve is of a deep blue, smells of sweetest flowers and just to be around it sends a thrill down my spine (and a stirring in my groin). It seems Sister [robmod_friggsister_magic.GetFirstName]’s invocations to Freyja, the Goddess of love, sex and fertility, were a success. But who knows what effect using it will have?;;;;;;;;;;;;;x
EVTDESC_ROBMODNORSE_00117_02;The tonic Sister [robmod_friggsister_magic.GetFirstName] has brewed is the colour of blood and tastes foul, but you can already feel yourself strengthen after she administers a single drop onto your tongue. She warns of ‘side-effects’, however...;;;;;;;;;;;;;x
EVTDESC_ROBMODNORSE_00117_03;You put your nose to the green bottle and inhale deeply as Sister [robmod_friggsister_magic.GetFirstName] orders. Instantly, you can feel your senses heightened and your mind quicken – the vapours she has concocted will certainly help you in your rigours. She warns you that the mind is a delicate thing, however...;;;;;;;;;;;;;x
EVTDESC_ROBMODNORSE_00117_04;A faded purple in colour and poorly hewn, the crystal Sister [robmod_friggsister_magic.GetFirstName] presents me with certainly doesn’t look like much. However, she claims that it will glow when someone thinks to do me harm. As if to prove her point, it begins to shine brightly in my hand...;;;;;;;;;;;;;x
EVTDESC_ROBMODNORSE_00117_05;The white hat [robmod_friggsister_magic.GetFirstName] made is imbued with a blessing from Kvasir, the God of wisdom and poetry. I look ridiculous when I put it on, but I do feel my mind clarify instantly. She warns that there is a chance that it will feed on my strength of body, however...;;;;;;;;;;;;;x
EVTOPTA_ROBMODNORSE_00117;I’ll take it!;;;;;;;;;;;;;x
EVTOPTB_ROBMODNORSE_00117;On second thoughts, no thanks.;;;;;;;;;;;;;x
### ORDER OF THE VANIR ###
## JOINING ##
EVTDESC_ROBMODNORSE_00255;Gods'blessings upon thee, [Root.GetTitledFirstName]\n\nWe are delighted by your decision to join our ranks as a lay member, [Root.GetTitle]. Together we shall strive for the betterment of ourselves and our fellow Beyðra by following the ways of the Vanir.\n\nMay the Vanir favour thee,\nSigned, [From.GetSocietyRank] [From.GetFirstName];[From.GetMOGreeting], [Root.GetTitledFirstName] \n\nNous sommes ravis de votre décision de rejoindre nos rangs en tant que membre lai[Root.GetNoneE]. Ensemble, nous nous efforcerons de nous dépasser, nous et nos camarades [Root.GetReligiousPerson]s, en respectant [From.GetMOCode].\n\n[From.GetMOFarewell],\nSigné, [From.GetSocietyRank] [From.GetFirstName];[From.GetMOGreeting], [Root.GetTitledFirstName],\n\nwir sind von Eurer Entscheidung, Euch als Laienmitglied unseren Reihen anzuschließen, entzückt, [Root.GetTitle]. Lasst uns gemeinsam durch den/die [From.GetMOCode] nach unserer eigenen Verbesserung und der Verbesserung [Root.GetReligiousPerson] Menschen streben.\n\n[From.GetMOFarewell],\nGezeichnet\n\n[From.GetSocietyRank] [From.GetFirstName];;[From.GetMOGreeting], [Root.GetTitledFirstName]\n\nNos complace tu decisión de unirte a nosotros, [Root.GetTitle]. Juntos lucharemos por superarnos a nosotros mismos y a nuestros compañeros [From.GetTrueReligionGroupPersons], guiados por la [From.GetMOCode].\n\n[From.GetMOFarewell].\nFirmado: [From.GetSocietyRank] [From.GetFirstName];;;;;;;;;x
EVTOPTA_ROBMODNORSE_00255;It is a great honor, [From.GetSocietyRank].;C'est un grand honneur, [From.GetSocietyRank].;Es ist mir eine große Ehre, [From.GetSocietyRank].;;Es un gran honor, [From.GetSocietyRank].;;;;;;;;;x
## QUESTS ##
# LEARN POTIONCRAFT #
EVTDESC_ROBMODNORSE_00238;Gods' blessings upon thee, [Root.GetSocietyRank] [Root.GetFirstName]\n\nA member of the Order of the Vanir should be skilled in brewing healing elixirs, philtres of desire, and poisonous decoctions. I challenge you to learn this craft, [Root.GetSocietyRank] [Root.GetFirstName], you will find the necessary instructions enclosed.\n\nMay the Vanir favour thee,\nSigned, [From.GetSocietyRank] [From.GetFirstName];[Root.GetMOGreeting], [Root.GetSocietyRank] [Root.GetFirstName] \n\nUn membre de l'Ordre du Vanir devrait être compétent pour préparer des élixirs de guérison, des philtres de désir et des décoctions toxiques. Je vous défie d'apprendre ce métier, [Root.GetSocietyRank] [Root.GetFirstName], vous trouverez les instructions nécessaires ci-jointes.\n\n[Root.GetMOFarewell],\nSigné, [From.GetSocietyRank] [From.GetFirstName];[Root.GetMOGreeting], [Root.GetSocietyRank] [Root.GetFirstName],\n\nEin Mitglied des Ordens des Vanir sollte in der Brauung heilenden Elixiere, Philtres des Verlangens und giftigen Abkochungen geschickt werden. Ich fordere Sie heraus, dieses Handwerk zu erlernen, [Root.GetSocietyRank] [Root.GetFirstName], finden Sie die notwendigen Anweisungen eingeschlossen.\n\n[Root.GetMOFarewell],\nGezeichnet\n\n[From.GetSocietyRank] [From.GetFirstName];;[Root.GetMOGreeting], [Root.GetSocietyRank] [Root.GetFirstName]:\n\nUn miembro de la Orden de los Vanir debe ser experto en la elaboración de los elixires curativos, los filósofos del deseo y las decocciones venenosas. Te reto a que aprendas este arte, [Root.GetSocietyRank] [Root.GetFirstName], encontrarás las instrucciones necesarias adjuntas.\n\n[Root.GetMOFarewell],\nFirmado: [From.GetSocietyRank] [From.GetFirstName];;;;;;;;;x
EVTDESC_ROBMODNORSE_00239;Looking through the instructions sent to you by [FromFrom.GetSocietyRank] [FromFrom.GetFirstName], it becomes clear that many exotic botanical ingredients are required in order to brew potions. Some are easily obtainable, others less so...;En regardant les instructions qui vous ont été envoyées par [FromFrom.GetSocietyRank] [FromFrom.GetFirstName], il devient clair que de nombreux ingrédients botaniques exotiques sont nécessaires pour préparer des potions. Certains sont faciles à obtenir, d'autres moins ...;Durch die durch Sie gesendeten Anweisungen durch [FromFrom.GetSocietyRank] [FromFrom.GetFirstName] wird deutlich, dass viele exotische botanische Zutaten benötigt werden, um Tränke zu brauen. Manche sind leicht zugänglich, andere weniger ...;;Mirando a través de las instrucciones enviadas a usted por [FromFrom.GetSocietyRank] [FromFrom.GetFirstName], se hace evidente que muchos ingredientes botánicos exóticos son necesarios para preparar pociones. Algunos son fácilmente obtenibles, otros menos ...;;;;;;;;;x
EVTOPTA_ROBMODNORSE_00239;Luckily, I have most of these plants in my expansive gardens!;Heureusement, j'ai la plupart de ces dans mes vastes jardins!;Zum Glück habe ich die meisten in meinen expansiven Gärten!;;Afortunadamente, tengo la mayoría de estos en mis extensos jardines!;;;;;;;;;x
EVTTOOLTIP_ROBMODNORSE_00239_01;Move onto trying out the recipes...;Déplacez-vous pour essayer les recettes ...;Bewegen Sie sich auf die Rezepte ...;;Vaya a probar las recetas ...;;;;;;;;;x
EVTOPTB_ROBMODNORSE_00239;I know of someone that will likely have these plants to hand.;Je connais quelqu'un qui aura probablement ces plantes à portée de main.;Ich kenne jemanden, der diese Pflanzen wahrscheinlich zur Hand haben wird.;;Sé de alguien que probablemente tendrá estas plantas a la mano.;;;;;;;;;x
EVTOPTC_ROBMODNORSE_00239;I suppose I shall have to search them out in the wild.;Je suppose que je devrais les chercher dans la nature.;Ich nehme an, ich muss sie in der Wildnis suchen.;;Supongo que tendré que buscarlos en la naturaleza.;;;;;;;;;x
EVTTOOLTIP_ROBMODNORSE_00239_02;Plant your own botanical garden;Plantez votre propre jardin botanique;Pflanze deinen eigenen botanischen Garten;;Planta tu propio jardín botánico;;;;;;;;;x
EVTDESC_ROBMODNORSE_00241;No matter what you try, the herbs and vegetables you planted for your potioncraft just won't grow. Clearly the Goddess Fjörgyn does not favour you!;Peu importe ce que vous essayez, les herbes et les légumes que vous avez plantés pour votre métier de potion ne grandiront jamais. De toute évidence, la déesse Fjörgyn ne vous favorise pas!;Egal, was Sie versuchen, die Kräuter und Gemüse, die Sie für Ihre Trank Handwerk gepflanzt wird einfach nicht wachsen. Klar, die Göttin Fjörgyn begünstigt dich nicht!;;No importa lo que usted intenta, las hierbas y las verduras que usted plantó para su arte de la poción apenas no crecerán. ¡Claramente la diosa Fjörgyn no le favorece!;;;;;;;;;x
EVTOPTA_ROBMODNORSE_00241;I suppose I must ask for help from the groundsmen... how embarrassing.;Je suppose que je dois demander de l'aide ... quel embarras.;Ich nehme an, ich muss um Hilfe bitten ... wie peinlich.;;Supongo que debo pedir ayuda ... qué vergüenza.;;;;;;;;;x
EVTOPTB_ROBMODNORSE_00241;This just isn't worth the hassle.;Cela ne vaut pas la peine.;Das ist einfach nicht der Mühe wert.;;Esto simplemente no vale la pena la molestia.;;;;;;;;;x
EVTTOOLTIP_ROBMODNORSE_00241_02;Give up on learning potioncraft. This will fail the current society quest;Abandonner l'apprentissage du métier de potion;Gib auf dem Lernen Trank Handwerk;;Abandone el aprendizaje del arte de la poción;;;;;;;;;x
EVTDESC_ROBMODNORSE_00240;The old texts are so archaic and difficult to decipher that your potioncrafting has been more than anything a simple matter of trial and error - and the pile of test-rat carcasses in the corner pay testament to your many errors. You're fairly confident your latest brew - a simple love potion - is safe: six of the ten rats you have tried it on showed no ill effects at all! But they are no substitute for a human test subject, who should also be able to tell you whether the damned thing actually works. You could try it yourself, or...;Les anciens textes sont si archaïques et difficiles à déchiffrer que votre artisanat de potions a été une question d'épreuve et d'erreur - et la pile de carcasses de rats d'essai dans le coin témoigne de vos nombreuses erreurs. Vous êtes assez confiant pour que votre dernière brasserie - une simple potion d'amour - soit sûre: six des dix rats dont vous l'avez essayé n'ont pas eu d'effets néfastes à tous! Mais ils ne remplacent pas un sujet de test humain, qui devrait également vous dire si la damnée fonctionne réellement. Vous pourriez l'essayer vous-même, ou ...;Die alten Texte sind so archaisch und schwer zu entziffern, dass dein Trank-Crafting eine Frage von Versuch und Irrtum war - und der Haufen von Test-Ratten-Schlachtkörpern in der Ecke bezahlen Testament zu deinen vielen Fehlern. Sie sind ziemlich zuversichtlich, Ihr aktuelles Gebräu - ein einfacher Liebestrank - ist sicher: sechs der zehn Ratten, die Sie ausprobiert haben, zeigten überhaupt keine negativen Auswirkungen! Aber sie sind kein Ersatz für ein menschliches Testpersonal, das auch in der Lage sein wird, Ihnen zu sagen, ob die verdammte Sache tatsächlich funktioniert. Du könntest es selbst ausprobieren ...;;Los viejos textos son tan arcaicos y difíciles de descifrar que su elaboración de pociones ha sido una cuestión de ensayo y error - y la pila de cadáveres de ratas de prueba en la esquina de pagar testamento a sus muchos errores. Estás bastante seguro de que tu último brebaje - una poción de amor simple - es seguro: seis de las diez ratas que has probado no mostraron efectos nocivos en absoluto! Pero no son un sustituto para un sujeto de prueba humano, que también debería ser capaz de decirle si la maldita cosa realmente funciona. Usted podría intentar usted mismo, o ...;;;;;;;;;x
EVTOPTA_ROBMODNORSE_00240;My prisoner [robmod_prisoner_guineapig.GetFirstName] is at my mercy.;Mon prisonnier [robmod_prisoner_guineapig.GetFirstName] doit l'essayer en premier.;Mein Gefangener [robmod_prisoner_guineapig.GetFirstName] soll es zuerst versuchen.;;Mi prisionero [robmod_prisoner_guineapig.GetFirstName] lo intentará primero.;;;;;;;;;x
EVTTOOLTIP_ROBMODNORSE_00240_01;Force [robmod_prisoner_guineapig.GetFullName] to test the potion;Force [robmod_prisoner_guineapig.GetFullName] pour tester la potion;Force [robmod_prisoner_guineapig.GetFullName], um den Trank zu testen;;Fuerza [robmod_prisoner_guineapig.GetFullName] para probar la poción;;;;;;;;;x
EVTTOOLTIP_ROBMODNORSE_00240_01a;completing the test without incident;compléter le test sans incident;den Test ohne Zwischenfall abzuschließen;;completar la prueba sin incidentes;;;;;;;;;x
EVTTOOLTIP_ROBMODNORSE_00240_01b;[robmod_prisoner_guineapig.GetFirstName] becoming ill;[robmod_prisoner_guineapig.GetFirstName] devenant malade;[robmod_prisoner_guineapig.GetFirstName] wird krank;;[robmod_prisoner_guineapig.GetFirstName] enfermarse;;;;;;;;;x
EVTOPTB_ROBMODNORSE_00240;My loyal subject [robmod_courtier_guineapig.GetFirstName] will try it for me.;Mon sujet fidèle [robmod_courtier_guineapig.GetFirstName] l'essayera pour moi.;Mein treues Thema [robmod_courtier_guineapig.GetFirstName] wird es für mich ausprobieren.;;Mi leal sujeto [robmod_courtier_guineapig.GetFirstName] lo probará para mí.;;;;;;;;;x
EVTTOOLTIP_ROBMODNORSE_00240_02;Force [robmod_courtier_guineapig.GetFullName] to test the potion;Force [robmod_courtier_guineapig.GetFullName] pour tester la potion;Force [robmod_courtier_guineapig.GetFullName], um den Trank zu testen;;Fuerza [robmod_courtier_guineapig.GetFullName] para probar la poción;;;;;;;;;x
EVTTOOLTIP_ROBMODNORSE_00240_02a;completing the test without incident;compléter le test sans incident;den Test ohne Zwischenfall abzuschließen;;completar la prueba sin incidentes;;;;;;;;;x
EVTTOOLTIP_ROBMODNORSE_00240_02b;[robmod_courtier_guineapig.GetFirstName] becoming ill;[robmod_courtier_guineapig.GetFirstName] devenant malade;[robmod_courtier_guineapig.GetFirstName] wird krank;;[robmod_courtier_guineapig.GetFirstName] enfermarse;;;;;;;;;x
EVTOPTC_ROBMODNORSE_00240;No, I should be the one to try it.;Non, je devrais être celui qui l'essaye.;Nein, ich sollte der Versuch sein, es zu versuchen.;;No, debo ser yo quien lo intente.;;;;;;;;;x
EVTTOOLTIP_ROBMODNORSE_00240_03;Test the potion on yourself. Brave...;Testez la potion sur vous-même. Courageux...;Testen Sie den Trank auf sich selbst. Mutig...;;Prueba la poción sobre ti. Valiente...;;;;;;;;;x
EVTTOOLTIP_ROBMODNORSE_00240_03a;completing the test without incident;compléter le test sans incident;den Test ohne Zwischenfall abzuschließen;;completar la prueba sin incidentes;;;;;;;;;x
EVTTOOLTIP_ROBMODNORSE_00240_03b;you becoming ill;vous devenez malade;du bist krank;;te enfermas;;;;;;;;;x
EVTDESC_ROBMODNORSE_00242_01;You take the bubbling potion down to your dungeons, and force [robmod_prisoner_guineapig.GetFirstName] to try it. [robmod_prisoner_guineapig.GetSheHeCap] splutters and coughs, but seems to be ok. However, after careful observation [robmod_prisoner_guineapig.GetSheHe] also shows no signs of increased libido - the love potion hasn't worked!;Vous prenez la potion bouillonnante dans vos donjons et forcez [robmod_prisoner_guineapig.GetFirstName] pour l'essayer. [robmod_prisoner_guineapig.GetSheHeCap] éclate et tousse, mais semble être correct. Cependant, après une observation attentive [robmod_prisoner_guineapig.GetSheHe] ne montre pas non plus de signes de libido accrue - la potion n'a pas fonctionné!;Du nimmst den sprudelnden Trank in deine Kerker und zwickst [robmod_prisoner_guineapig.GetFirstName], um es zu versuchen. [robmod_prisoner_guineapig.GetSheHeCap] splutters und hustet, scheint aber ok zu sein. Doch nach sorgfältiger Beobachtung [robmod_prisoner_guineapig.GetSheHe] zeigt auch keine Anzeichen einer erhöhten Libido - der Trank hat nicht gearbeitet!;;Toma la poción burbujeante hasta tus mazmorras, y fuerza [robmod_prisoner_guineapig.GetFirstName] para intentarlo. [robmod_prisoner_guineapig.GetSheHeCap] splutters y toses, pero parece estar bien. Sin embargo, después de una observación cuidadosa (robmod_prisoner_guineapig.GetSheHe) también no muestra signos de aumento de la libido - la poción no ha funcionado!;;;;;;;;;x
EVTDESC_ROBMODNORSE_00242_02;You take the bubbling potion down to your dungeons, and force [robmod_prisoner_guineapig.GetFirstName] to try it. [robmod_prisoner_guineapig.GetSheHeCap] seems ok for a second or two, but then begins vomitting violently, and runs to the bucket in the corner! It seems the potion still requires some work...;Vous prenez la potion bouillonnante dans vos donjons et forcez [robmod_prisoner_guineapig.GetFirstName] pour l'essayer. [robmod_prisoner_guineapig.GetSheHeCap] semble correct pour une seconde ou deux, mais commence à vomir violemment et court vers le seau dans le coin! Il semble que la potion demande encore du travail ...;Du nimmst den sprudelnden Trank in deine Kerker und zwickst [robmod_prisoner_guineapig.GetFirstName], um es zu versuchen. [robmod_prisoner_guineapig.GetSheHeCap] scheint für ein oder zwei Sekunden ok, aber dann beginnt er heftig zu erbrechen und läuft zum Eimer in der Ecke! Es scheint, dass der Trank noch etwas Arbeit braucht ...;;Toma la poción burbujeante hasta tus mazmorras, y fuerza [robmod_prisoner_guineapig.GetFirstName] para intentarlo. [robmod_prisoner_guineapig.GetSheHeCap] parece estar bien por un segundo o dos, pero luego empieza a vomitar violentamente, y corre al cubo en la esquina! Parece que la poción todavía requiere algo de trabajo ...;;;;;;;;;x
EVTDESC_ROBMODNORSE_00242_03;You call for [robmod_courtier_guineapig.GetFirstName] and force [robmod_courtier_guineapig.GetHerHim] to try the bubbling potion. [robmod_courtier_guineapig.GetSheHeCap] splutters and coughs, but seems to be ok. However, on questioning the next day, [robmod_courtier_guineapig.GetSheHe] also reports no signs of increased libido - the love potion hasn't worked!;Vous appelez [robmod_courtier_guineapig.GetFirstName] et forcer [robmod_courtier_guineapig.GetHerHim] à essayer la potion bouillonnante. [robmod_courtier_guineapig.GetSheHeCap] éclate et tousse, mais semble être correct. Toutefois, lors d'un interrogatoire le lendemain, [robmod_courtier_guineapig.GetSheHe] ne signale pas non plus de signes de libido accrue - la potion n'a pas fonctionné!;Sie rufen nach [robmod_courtier_guineapig.GetFirstName] und zwingen [robmod_courtier_guineapig.GetHerHim], den sprudelnden Trank auszuprobieren. [robmod_courtier_guineapig.GetSheHeCap] splutters und hustet, scheint aber ok zu sein. Doch bei der Befragung am nächsten Tag berichtet [robmod_courtier_guineapig.GetSheHe] auch keine Anzeichen einer erhöhten Libido - der Trank hat nicht gearbeitet!;;Usted llama para [robmod_courtier_guineapig.GetFirstName] y fuerza [robmod_courtier_guineapig.GetHerHim] para probar la poción burbujeante. [robmod_courtier_guineapig.GetSheHeCap] splutters y toses, pero parece estar bien. Sin embargo, al preguntar al día siguiente, [robmod_courtier_guineapig.GetSheHe] también no informa de signos de aumento de la libido - la poción no ha funcionado!;;;;;;;;;x
EVTDESC_ROBMODNORSE_00242_04;You call for [robmod_courtier_guineapig.GetFirstName] and force [robmod_courtier_guineapig.GetHerHim] to try the bubbling potion. [robmod_courtier_guineapig.GetSheHeCap] seems ok for a second or two, but then begins vomitting violently on the floor, and runs to the privy! It seems the potion still requires some work...;Vous appelez [robmod_courtier_guineapig.GetFirstName] et forcer [robmod_courtier_guineapig.GetHerHim] à essayer la potion bouillonnante. [robmod_courtier_guineapig.GetSheHeCap] semble correct pour une seconde ou deux, mais commence à vomir violemment sur le sol et court au privé! Il semble que la potion demande encore du travail ...;Sie rufen nach [robmod_courtier_guineapig.GetFirstName] und zwingen [robmod_courtier_guineapig.GetHerHim], den sprudelnden Trank auszuprobieren. [robmod_courtier_guineapig.GetSheHeCap] scheint für ein oder zwei Sekunden ok, aber dann beginnt er heftig auf dem Boden zu erbrechen und läuft ins Geheimnis! Es scheint, dass der Trank noch etwas Arbeit braucht ...;;Usted llama para [robmod_courtier_guineapig.GetFirstName] y fuerza [robmod_courtier_guineapig.GetHerHim] para probar la poción burbujeante. [robmod_courtier_guineapig.GetSheHeCap] parece estar bien por un segundo o dos, pero luego empieza a vomitar violentamente en el piso, y corre a la privada! Parece que la poción todavía requiere algo de trabajo ...;;;;;;;;;x
EVTDESC_ROBMODNORSE_00242_05;You put the bubbling flask to your lips, and take a deep gulp of the potion. The foul taste makes your retch, but you feel ok. However, over the next few hours you feel no increase in your libido and the physical effects are... disappointing. The love potion hasn't worked!;Vous mettez le flacon bouillonnant sur vos lèvres, et prenez un glas profond de la potion. Le goût délicat rend votre vrille, mais vous vous sentez bien. Cependant, au cours des prochaines heures, vous ne ressentez aucune augmentation de votre libido et les effets physiques sont ... décevants. La potion d'amour n'a pas fonctionné!;Du legst die sprudelnde Flasche auf deine Lippen und nimm einen tiefen Schluck des Trankes. Der faule Geschmack macht deinen Rückschlag, aber du fühlst dich ok. Doch in den nächsten Stunden fühlst du keinen Anstieg in deiner Libido und die physischen Effekte sind ... enttäuschend. Der Liebestrank hat nicht gearbeitet!;;Pones el frasco de burbujas en tus labios y toma un trago profundo de la poción. El mal sabor hace que tu vómito, pero te sientes bien. Sin embargo, en las próximas horas no sientes ningún aumento en tu libido y los efectos físicos son ... decepcionantes. ¡La poción de amor no ha funcionado!;;;;;;;;;x
